{
  "schema": "agenomic.prompt_artifact_set/v1",
  "prompt_manifest_digest": "sha256:1a557c5dd2c8c9153571e57e855c4ac6180793dc58f652af61ab14ff6fc35214",
  "manifest": {
    "schema": "agenomic.prompt_manifest/v1",
    "agent_id": "2b1e5c3a-8d4f-4e6a-9b0c-1d2e3f4a5b6c",
    "slots": {
      "planner.instructions": {
        "prompt_id": "prm_support_planner",
        "version": 9,
        "content_digest": "sha256:5ad0e07bf5dfb86e45302963f04ef455fa4f965622ca97f55e48cf7ff6956f31"
      }
    },
    "children": {}
  },
  "children": {},
  "prompts": {
    "prm_support_planner:9": {
      "prompt_id": "prm_support_planner",
      "version": 9,
      "prompt_kind": "text",
      "content_digest": "sha256:5ad0e07bf5dfb86e45302963f04ef455fa4f965622ca97f55e48cf7ff6956f31",
      "content": {
        "schema": "agenomic.prompt_content/v1",
        "template_format": "agenomic-fstring/v1",
        "renderer_version": "1",
        "kind": "text",
        "body": "Plan the next step.\n{>safety}",
        "variables": {},
        "partials": {},
        "output_contract": null,
        "fragments": {
          "safety": {
            "prompt_id": "prm_support_safety",
            "version": 2,
            "content_digest": "sha256:a2872f182adfd75526c1f6a8eb91424c907e42b500f38c24edd759575e7f239d"
          }
        }
      }
    },
    "prm_support_safety:2": {
      "prompt_id": "prm_support_safety",
      "version": 2,
      "prompt_kind": "fragment",
      "content_digest": "sha256:a2872f182adfd75526c1f6a8eb91424c907e42b500f38c24edd759575e7f239d",
      "content": {
        "schema": "agenomic.prompt_content/v1",
        "template_format": "agenomic-fstring/v1",
        "renderer_version": "1",
        "kind": "text",
        "body": "Never share internal notes.",
        "variables": {},
        "partials": {},
        "output_contract": null,
        "fragments": {}
      }
    }
  }
}
